Titulo,Preco,Loja,Link
Tênis Adidas Energy Falcon Masculino,"R$ 189,99",Magazine Luiza,https://www.buscape.com.br/search?q=/lead?oid=293716975&channel=86&searchterm=Tenis%20adidas%20
Tênis Adidas Superstar Preto  unissex,"R$ 349,90",Dafiti,https://www.buscape.com.br/search?q=/lead?oid=324982586&channel=86&searchterm=Tenis%20adidas%20
Tênis Adidas Galaxar Run Masculino,"R$ 249,99",Magazine Luiza,https://www.buscape.com.br/search?q=/lead?oid=258009791&channel=86&searchterm=Tenis%20adidas%20
Tênis adidas Originals Xplr S Preto ADIDAS Originals EF5506 masculino,"R$ 339,99",Dafiti,https://www.buscape.com.br/search?q=/lead?oid=252210270&channel=86&searchterm=Tenis%20adidas%20
Tênis Adidas Duramo SL Feminino,"R$ 220,99",Magazine Luiza,https://www.buscape.com.br/search?q=/lead?oid=325508114&channel=86&searchterm=Tenis%20adidas%20
Tênis adidas Originals Superstar Preto/Branco preto feminino,"R$ 369,99",Kanui,https://www.buscape.com.br/search?q=/lead?oid=189595892&channel=86&searchterm=Tenis%20adidas%20
