Titulo,Preco,Loja,Link
Arroz Tio João 100% Grãos Nobres - 1kg,"R$ 7,80",Amazon,https://www.buscape.com.br/search?q=/lead?oid=287074709&channel=86&searchterm=Arroz
Arroz Tio João Parbolizado - 1kg,"R$ 5,98",Amazon,https://www.buscape.com.br/search?q=/lead?oid=287072805&channel=86&searchterm=Arroz
Arroz Negro 100g,"R$ 5,30",Amazon,https://www.buscape.com.br/search?q=/lead?oid=171708947&channel=86&searchterm=Arroz
Tio João Variedades Mundiais Arroz Jasmine - 1kg ,"R$ 15,98",DrogaRaia.com,https://www.buscape.com.br/search?q=/lead?oid=373923287&channel=86&searchterm=Arroz
Arroz Italiano Arbório Paganini 500g,"R$ 16,90",Amazon,https://www.buscape.com.br/search?q=/lead?oid=401021610&channel=86&searchterm=Arroz
Arroz Tio João Parboilizado 1kg,"R$ 5,98",Magazine Luiza,https://www.buscape.com.br/search?q=/lead?oid=209420494&channel=86&searchterm=Arroz
Arroz Cateto Polido Biodinâmico (Orgânico) 1Kg - Volkmann,"R$ 18,80",Projeto Verão,https://www.buscape.com.br/search?q=/lead?oid=176269457&channel=86&searchterm=Arroz
Arroz Natural Basmati Scotti 500g,"R$ 18,40",Amazon,https://www.buscape.com.br/search?q=/lead?oid=173590757&channel=86&searchterm=Arroz
Arroz Integral 1KG Camil,"R$ 19,90",Shoptime,https://www.buscape.com.br/search?q=/lead?oid=406644079&channel=86&searchterm=Arroz
Arroz Tio João Integral - 500g,"R$ 3,99",Magazine Luiza,https://www.buscape.com.br/search?q=/lead?oid=402375636&channel=86&searchterm=Arroz
Arroz Arborio La Pastina 500G,"R$ 21,93",Amazon,https://www.buscape.com.br/search?q=/lead?oid=398945772&channel=86&searchterm=Arroz
Arroz Basmati La Pastina 500 Gr,"R$ 39,60",Amazon,https://www.buscape.com.br/search?q=/lead?oid=376547178&channel=86&searchterm=Arroz
Arroz Paella La Pastina 1 kg,"R$ 48,70",Amazon,https://www.buscape.com.br/search?q=/lead?oid=376546882&channel=86&searchterm=Arroz
Arroz Tio João Integral Boil in Bag - 1kg ,"R$ 7,48",DrogaRaia.com,https://www.buscape.com.br/search?q=/lead?oid=373923340&channel=86&searchterm=Arroz
Tio João Variedades Mundiais Institucional Arroz Jasmine - 1kg ,"R$ 15,48",DrogaRaia.com,https://www.buscape.com.br/search?q=/lead?oid=373923056&channel=86&searchterm=Arroz
Arroz Carnaroli Paganini 1kg,"R$ 25,21",Amazon,https://www.buscape.com.br/search?q=/lead?oid=372567828&channel=86&searchterm=Arroz
Arroz Arbóreo Paganini 1kg,"R$ 25,21",Amazon,https://www.buscape.com.br/search?q=/lead?oid=372566959&channel=86&searchterm=Arroz
Arroz Negro Selvagem Orgânico CooperNatural 1Kg,"R$ 56,63",Amazon,https://www.buscape.com.br/search?q=/lead?oid=357691458&channel=86&searchterm=Arroz
Arroz Integral Agulinha 500g,"R$ 10,95",Amazon,https://www.buscape.com.br/search?q=/lead?oid=357691311&channel=86&searchterm=Arroz
Arroz Italiano Vialone Nano Paganini 500g,"R$ 25,90",Shoptime,https://www.buscape.com.br/search?q=/lead?oid=353708663&channel=86&searchterm=Arroz
Arroz Carnaroli Riso Inverni 500g,"R$ 16,65",Shoptime,https://www.buscape.com.br/search?q=/lead?oid=349400299&channel=86&searchterm=Arroz
Arroz Misturadinho Ecobio Orgânico 500g 500g,"R$ 10,91",DrogaRaia.com,https://www.buscape.com.br/search?q=/lead?oid=344021769&channel=86&searchterm=Arroz
Arroz Negro Integral Orgânico CooperNatural 500g,"R$ 32,94",Amazon,https://www.buscape.com.br/search?q=/lead?oid=341350131&channel=86&searchterm=Arroz
"Ração Nestlé Purina ProPlan Urinary para Gatos Adultos Sabor Frango e Arroz - 7,5kg Purina para Todas Todos os tamanhos de raça Adulto - Sabor Frango","R$ 191,00",Amazon,https://www.buscape.com.br/search?q=/lead?oid=322315100&channel=86&searchterm=Arroz%205kg
Arroz Tipo 1 5kg Camil,"R$ 25,90",Americanas,https://www.buscape.com.br/search?q=/lead?oid=336268731&channel=86&searchterm=Arroz%205kg
"Ração Natural Guabi para Gatos Sênior Castrados sabor Frango e Arroz - 7,5kg","R$ 238,90",Amazon,https://www.buscape.com.br/search?q=/lead?oid=171693942&channel=86&searchterm=Arroz%205kg
"Ração Nestlé Purina ProPlan para Gatos Adultos Sabor Frango e Arroz - 7,5kg","R$ 233,29",Amazon,https://www.buscape.com.br/search?q=/lead?oid=286299842&channel=86&searchterm=Arroz%205kg
"Ração Guabi Natural para Gatos Adultos Frango e Arroz 1,5kg - 7,5kg","R$ 212,99",Amazon,https://www.buscape.com.br/search?q=/lead?oid=171048165&channel=86&searchterm=Arroz%205kg
Arroz Tipo 1 5kg Camil,"R$ 25,90",Shoptime,https://www.buscape.com.br/search?q=/lead?oid=349545237&channel=86&searchterm=Arroz%205kg
"Ração Baw Waw Natural Pro para cães raças pequenas sabor Frango e Arroz - 2,5kg","R$ 29,90",Amazon,https://www.buscape.com.br/search?q=/lead?oid=172426676&channel=86&searchterm=Arroz%205kg
"Ração Guabi para Gatos Castrados Frango e Arroz - 7,5kg","R$ 224,90",Amazon,https://www.buscape.com.br/search?q=/lead?oid=171041031&channel=86&searchterm=Arroz%205kg
"Ração Baw Waw Natural Pro para cães filhotes sabor Frango e Arroz - 2,5kg","R$ 29,24",Amazon,https://www.buscape.com.br/search?q=/lead?oid=239687746&channel=86&searchterm=Arroz%205kg
"Ração Nestlé Purina ProPlan Sterilized para Gatos Adultos Sabor Salmão e Arroz - 7,5kg Purina para Todas Todos os tamanhos de raça Todas as fases - Sabor Outro","R$ 237,79",Amazon,https://www.buscape.com.br/search?q=/lead?oid=177716513&channel=86&searchterm=Arroz%205kg
"GUABI NATURAL CAO FILHOTE MEDIO FRANGO E ARROZ 2,5kg","R$ 102,99",Amazon,https://www.buscape.com.br/search?q=/lead?oid=201799719&channel=86&searchterm=Arroz%205kg
"Ração Nestlé Purina ProPlan para cães Raças Pequenas sabor Frango e Arroz - 7,5kg","R$ 218,99",Amazon,https://www.buscape.com.br/search?q=/lead?oid=171693892&channel=86&searchterm=Arroz%205kg
Ração Nestlé Purina para Cães Raças Pequenas Reduced Calorie Frango e Arroz - 7.5kg,"R$ 218,99",Amazon,https://www.buscape.com.br/search?q=/lead?oid=171693883&channel=86&searchterm=Arroz%205kg
"Ração Natural Guabi para Gatos Sênior Castrados sabor Frango e Arroz - 1,5kg","R$ 98,99",Amazon,https://www.buscape.com.br/search?q=/lead?oid=171038725&channel=86&searchterm=Arroz%205kg
"Ração Guabi Natural Para Cães Filhotes De Raças Pequenas Sabor Frango & Arroz Integral 2,5Kg","R$ 106,99",Carrefour,https://www.buscape.com.br/search?q=/lead?oid=373888514&channel=86&searchterm=Arroz%205kg
"Ração Guabi Natural Gatos Adulto Frango E Arroz Integral 7,5Kg","R$ 212,90",Carrefour,https://www.buscape.com.br/search?q=/lead?oid=360726929&channel=86&searchterm=Arroz%205kg
"Ração Guabi Natural Cães Filhote Raça Mini E Pequena Frango E Arroz Integral 2,5Kg","R$ 106,90",Carrefour,https://www.buscape.com.br/search?q=/lead?oid=360726925&channel=86&searchterm=Arroz%205kg
"Ração Guabi Natural Cães Filhotes Médio Frango E Arroz Integral 2,5Kg","R$ 102,90",Carrefour,https://www.buscape.com.br/search?q=/lead?oid=360674647&channel=86&searchterm=Arroz%205kg
"Ração Guabi Natural Para Cães Sênior Sabor Frango E Arroz - 2,5Kg","R$ 106,90",Carrefour,https://www.buscape.com.br/search?q=/lead?oid=352189734&channel=86&searchterm=Arroz%205kg
"Ração Baw Waw Natural Pro para cães raças pequenas sabor Carne e Arroz - 2,5kg","R$ 26,52",Amazon,https://www.buscape.com.br/search?q=/lead?oid=346237427&channel=86&searchterm=Arroz%205kg
"Ração Baw Waw Natural Pro para cães filhotes sabor Carne e Arroz - 2,5kg","R$ 26,36",Amazon,https://www.buscape.com.br/search?q=/lead?oid=346237414&channel=86&searchterm=Arroz%205kg
"MATISSE FRANGO ARROZ 7,5KG","R$ 159,09",Amazon,https://www.buscape.com.br/search?q=/lead?oid=255934130&channel=86&searchterm=Arroz%205kg
"Ração Nestlé Purina ProPlan Sterilized para Gatos Adultos Sabor Salmão e Arroz - 7,5kg Purina para Todas Todos os tamanhos de raça Todas as fases - Sabor Outro","R$ 232,90",Amazon,https://www.buscape.com.br/search?q=/lead?oid=228002912&channel=86&searchterm=Arroz%205kg
"Ração Guabi para Gatos Castrados Frango e Arroz 1,5kg","R$ 98,99",Amazon,https://www.buscape.com.br/search?q=/lead?oid=201787494&channel=86&searchterm=Arroz%205kg
"Ração Guabi Cães Adultos Raças Médias Frango Arroz - 2,5kg","R$ 97,99",Amazon,https://www.buscape.com.br/search?q=/lead?oid=173097092&channel=86&searchterm=Arroz%205kg
"Ração Baw Waw Natural Pro para gatos castrados sabor Carne e Arroz - 2,5kg","R$ 28,47",Amazon,https://www.buscape.com.br/search?q=/lead?oid=172426300&channel=86&searchterm=Arroz%205kg
"Ração Guabi Natural Cães Filhotes Frango & Arroz - 2,5kg","R$ 106,99",Amazon,https://www.buscape.com.br/search?q=/lead?oid=171044626&channel=86&searchterm=Arroz%205kg
Arroz Branco Polido 5kg Tio Joao,"R$ 33,99",Shoptime,https://www.buscape.com.br/search?q=/lead?oid=352269311&channel=86&searchterm=Arroz%205kg
Arroz Branco 5kg Tio Urbano,"R$ 59,90",Submarino,https://www.buscape.com.br/search?q=/lead?oid=400181061&channel=86&searchterm=Arroz%205kg
Arroz Parboilizado Polido 5kg Tio Joao,"R$ 31,99",Submarino,https://www.buscape.com.br/search?q=/lead?oid=354792985&channel=86&searchterm=Arroz%205kg
Tupperware Caixa Arroz PB Fun 5kg Preto e Branco,"R$ 118,70",Amazon,https://www.buscape.com.br/search?q=/lead?oid=284442932&channel=86&searchterm=Arroz%205kg
Arroz Tipo 2 5kg Camil,"R$ 24,90",Shoptime,https://www.buscape.com.br/search?q=/lead?oid=235592651&channel=86&searchterm=Arroz%205kg
Arroz Japonês Momiji Longo - 5kg,"R$ 67,20",Shoptime,https://www.buscape.com.br/search?q=/lead?oid=68251876&channel=86&searchterm=Arroz%205kg
Arroz Japonês Inari 5kg,"R$ 61,32",Submarino,https://www.buscape.com.br/search?q=/lead?oid=67992527&channel=86&searchterm=Arroz%205kg
Arroz Japonês Inari 5kg,"R$ 61,32",Shoptime,https://www.buscape.com.br/search?q=/lead?oid=67992353&channel=86&searchterm=Arroz%205kg
Arroz Japonês Inari 5kg,"R$ 61,32",Americanas,https://www.buscape.com.br/search?q=/lead?oid=67992100&channel=86&searchterm=Arroz%205kg
